{
  "$comment": "Generated by `arkdeck maintainer contracts export`; do not edit by hand.",
  "$defs": {
    "eventItem": {
      "properties": {
        "cursor": {
          "minLength": 1,
          "type": "string"
        },
        "data": {},
        "eventId": {
          "minLength": 1,
          "type": "string"
        },
        "runtimeRevision": {
          "type": "string"
        },
        "streamPosition": {
          "pattern": "^[1-9][0-9]*$",
          "type": "string"
        },
        "type": {
          "minLength": 1,
          "type": "string"
        }
      },
      "required": [
        "eventId",
        "streamPosition",
        "cursor",
        "type"
      ],
      "type": "object"
    }
  },
  "$schema": "https://json-schema.org/draft/2020-12/schema",
  "additionalProperties": false,
  "allOf": [
    {
      "if": {
        "properties": {
          "pageKind": {
            "const": "eventStream"
          }
        }
      },
      "then": {
        "properties": {
          "items": {
            "items": {
              "$ref": "#/$defs/eventItem"
            }
          },
          "nextCursor": {
            "minLength": 1,
            "type": "string"
          },
          "order": {
            "const": "streamPositionAsc"
          }
        }
      }
    },
    {
      "if": {
        "properties": {
          "hasMore": {
            "const": false
          },
          "pageKind": {
            "const": "snapshot"
          }
        }
      },
      "then": {
        "properties": {
          "nextCursor": {
            "type": "null"
          }
        }
      }
    },
    {
      "if": {
        "properties": {
          "hasMore": {
            "const": true
          }
        }
      },
      "then": {
        "properties": {
          "nextCursor": {
            "minLength": 1,
            "type": "string"
          }
        }
      }
    }
  ],
  "description": "The fixed page shape every list and events result uses (§7.3).",
  "properties": {
    "hasMore": {
      "type": "boolean"
    },
    "items": {
      "type": "array"
    },
    "nextCursor": {
      "type": [
        "string",
        "null"
      ]
    },
    "order": {
      "minLength": 1,
      "type": "string"
    },
    "pageKind": {
      "enum": [
        "snapshot",
        "eventStream"
      ]
    },
    "schemaVersion": {
      "const": "arkdeck.cli.page/1"
    },
    "snapshotRevision": {
      "type": "string"
    }
  },
  "required": [
    "schemaVersion",
    "pageKind",
    "items",
    "order",
    "snapshotRevision",
    "hasMore",
    "nextCursor"
  ],
  "title": "arkdeck.cli.page/1",
  "type": "object",
  "x-arkdeck-bundleVersion": "arkdeck.cli.contracts/1",
  "x-arkdeck-cliVersion": "0.1.0"
}
